{
  "version": "0.1.0",
  "lastUpdate": "2026-10-29T00:00:00.000Z",
  "count": 6,
  "source": "https://observatorioia.org",
  "license": "CC BY 4.0",
  "data": {
    "ilia2025": [
      {
        "pais": {
          "es": "Chile",
          "en": "Chile"
        },
        "ilia": 70.56,
        "edicion": 2025,
        "fuenteUrl": "https://indicelatam.cl/wp-content/uploads/2025/10/Documento_ILIA_2025.pdf"
      },
      {
        "pais": {
          "es": "Brasil",
          "en": "Brazil"
        },
        "ilia": 67.39,
        "edicion": 2025,
        "fuenteUrl": "https://indicelatam.cl/wp-content/uploads/2025/10/Documento_ILIA_2025.pdf"
      },
      {
        "pais": {
          "es": "Uruguay",
          "en": "Uruguay"
        },
        "ilia": 62.32,
        "edicion": 2025,
        "fuenteUrl": "https://indicelatam.cl/wp-content/uploads/2025/10/Documento_ILIA_2025.pdf"
      },
      {
        "pais": {
          "es": "Colombia",
          "en": "Colombia"
        },
        "ilia": 55.84,
        "edicion": 2025,
        "fuenteUrl": "https://indicelatam.cl/wp-content/uploads/2025/10/Documento_ILIA_2025.pdf"
      },
      {
        "pais": {
          "es": "Costa Rica",
          "en": "Costa Rica"
        },
        "ilia": 53.83,
        "edicion": 2025,
        "fuenteUrl": "https://indicelatam.cl/wp-content/uploads/2025/10/Documento_ILIA_2025.pdf",
        "destacado": true
      }
    ],
    "comparativaRegional": [
      {
        "pais": {
          "es": "Chile",
          "en": "Chile"
        },
        "ilia": 70.56,
        "iliaEdicion": 2025,
        "iliaFuenteUrl": "https://indicelatam.cl/wp-content/uploads/2025/10/Documento_ILIA_2025.pdf",
        "inversion": {
          "es": "USD 32M",
          "en": "USD 32M"
        },
        "enteEjecutor": {
          "es": "CENIA (Centro Nacional de IA), operativo",
          "en": "CENIA (National AI Center), operational"
        },
        "hito": {
          "es": "Latam-GPT, modelo regional de 70B parámetros desarrollado por USD 550K.",
          "en": "Latam-GPT, regional 70B-parameter model built for USD 550K."
        },
        "fuentes": [
          {
            "url": "https://ucstrategies.com/news/latam-gpt-chile-built-a-national-ai-for-550k-and-its-running-on-amazons-servers/",
            "descripcion": {
              "es": "UC Strategies — cobertura del lanzamiento de Latam-GPT (Chile, USD 550K).",
              "en": "UC Strategies — Latam-GPT launch coverage (Chile, USD 550K)."
            }
          }
        ]
      },
      {
        "pais": {
          "es": "Brasil",
          "en": "Brazil"
        },
        "ilia": 67.39,
        "iliaEdicion": 2025,
        "iliaFuenteUrl": "https://indicelatam.cl/wp-content/uploads/2025/10/Documento_ILIA_2025.pdf",
        "inversion": {
          "es": "USD 4,000M (PBIA)",
          "en": "USD 4,000M (PBIA)"
        },
        "enteEjecutor": {
          "es": "Plan Brasileiro de IA (PBIA), liderado por MCTI",
          "en": "Brazilian AI Plan (PBIA), led by MCTI"
        },
        "hito": {
          "es": "Mayor inversión absoluta en IA en América Latina.",
          "en": "Largest absolute AI investment in Latin America."
        },
        "fuentes": [
          {
            "url": "https://www.gov.br/mcti/",
            "descripcion": {
              "es": "MCTI — Ministerio de Ciencia, Tecnología e Innovaciones de Brasil (sitio oficial del Plan Brasileiro de IA).",
              "en": "MCTI — Brazilian Ministry of Science, Technology and Innovation (official site of the Brazilian AI Plan)."
            }
          }
        ]
      },
      {
        "pais": {
          "es": "Uruguay",
          "en": "Uruguay"
        },
        "ilia": 62.32,
        "iliaEdicion": 2025,
        "iliaFuenteUrl": "https://indicelatam.cl/wp-content/uploads/2025/10/Documento_ILIA_2025.pdf",
        "inversion": {
          "es": "Agesic con presupuesto operativo desde 2007",
          "en": "Agesic with operating budget since 2007"
        },
        "enteEjecutor": {
          "es": "Agesic",
          "en": "Agesic"
        },
        "hito": {
          "es": "Estrategia Nacional IA 2024-2030 aprobada con 40+ instituciones; programa Ceibal capacitó a 80,000 estudiantes en IA. En diciembre 2025, el Decreto 276/025 estableció el esquema de sandboxes regulatorios para IA y espacios de datos (entornos controlados de prueba bajo supervisión pública). En abril 2026, Parlamento y Ceibal lanzaron un ciclo de formación en IA para legisladores y funcionarios.",
          "en": "National AI Strategy 2024-2030 approved with 40+ institutions; Ceibal program trained 80,000 students in AI. In December 2025, Decree 276/025 established the regulatory sandbox framework for AI and data spaces (supervised controlled testing environments). In April 2026, Parliament and Ceibal launched an AI training cycle for legislators and public officials."
        },
        "fuentes": [
          {
            "url": "https://www.impo.com.uy/bases/decretos/276-2025",
            "nombre": {
              "es": "IMPO",
              "en": "IMPO"
            },
            "descripcion": {
              "es": "IMPO (Diario Oficial de Uruguay) — Decreto 276/025 que establece el esquema de gobernanza para sandboxes regulatorios de IA (dic. 2025).",
              "en": "IMPO (Uruguay's Official Gazette) — Decree 276/025 establishing the governance framework for AI regulatory sandboxes (Dec. 2025)."
            }
          },
          {
            "url": "https://www.uruguayxxi.gub.uy/en/news/article/80-000-uruguayan-students-trained-in-artificial-intelligence-by-2023/",
            "nombre": {
              "es": "Uruguay XXI",
              "en": "Uruguay XXI"
            },
            "descripcion": {
              "es": "Uruguay XXI — reporte oficial sobre 80,000 estudiantes capacitados en IA por Ceibal.",
              "en": "Uruguay XXI — official report on 80,000 students trained in AI by Ceibal."
            }
          },
          {
            "url": "https://www.sociedaduruguaya.org/2026/04/parlamento-y-ceibal-lanzan-ciclo-de-formacion-en-inteligencia-artificial-para-legisladores-y-funcionarios.html",
            "nombre": {
              "es": "Sociedad Uruguaya",
              "en": "Sociedad Uruguaya"
            },
            "descripcion": {
              "es": "Sociedad Uruguaya — Ciclo de formación IA Parlamento + Ceibal para legisladores (abr. 2026).",
              "en": "Sociedad Uruguaya — Parliament + Ceibal AI training cycle for legislators (Apr. 2026)."
            }
          }
        ]
      },
      {
        "pais": {
          "es": "Colombia",
          "en": "Colombia"
        },
        "ilia": 55.84,
        "iliaEdicion": 2025,
        "iliaFuenteUrl": "https://indicelatam.cl/wp-content/uploads/2025/10/Documento_ILIA_2025.pdf",
        "inversion": {
          "es": "Política Nacional de IA aprobada (CONPES)",
          "en": "National AI Policy approved (CONPES)"
        },
        "enteEjecutor": {
          "es": "MinTIC + DNP",
          "en": "MinTIC + DNP"
        },
        "hito": {
          "es": "CONPES de IA aprobado y agenda de transformación digital activa.",
          "en": "AI CONPES approved and active digital transformation agenda."
        },
        "fuentes": [
          {
            "url": "https://www.mintic.gov.co/",
            "descripcion": {
              "es": "MinTIC — Ministerio de Tecnologías de la Información y las Comunicaciones de Colombia (sitio oficial).",
              "en": "MinTIC — Colombia's Ministry of Information and Communications Technologies (official site)."
            }
          }
        ]
      },
      {
        "pais": {
          "es": "Costa Rica",
          "en": "Costa Rica"
        },
        "ilia": 53.83,
        "iliaEdicion": 2025,
        "iliaFuenteUrl": "https://indicelatam.cl/wp-content/uploads/2025/10/Documento_ILIA_2025.pdf",
        "inversion": {
          "es": "Sin presupuesto IA explícito en presupuesto nacional",
          "en": "No explicit AI budget in national budget"
        },
        "enteEjecutor": {
          "es": "MICITT (Centro Nacional de Excelencia IA pendiente)",
          "en": "MICITT (National AI Center of Excellence pending)"
        },
        "hito": {
          "es": "ENIA 2024-2027 publicada (primera política nacional de IA de Centroamérica). Hacienda recuperó ₡8,000M con IA en 2025.",
          "en": "ENIA 2024-2027 published (first national AI policy in Central America). Hacienda recovered ₡8,000M with AI in 2025."
        },
        "fuentes": [
          {
            "url": "https://micitt.go.cr/el-sector-informa/micitt-presento-estrategia-nacional-de-inteligencia-artificial-enia",
            "descripcion": {
              "es": "MICITT — Presentación oficial de la Estrategia Nacional de Inteligencia Artificial (ENIA) de Costa Rica.",
              "en": "MICITT — Official launch of Costa Rica's National AI Strategy (ENIA)."
            }
          }
        ],
        "destacado": true
      }
    ],
    "kpisHero": [
      {
        "label": {
          "es": "Iniciativas relacionadas con IA documentadas",
          "en": "Documented AI-related initiatives"
        },
        "valor": "42",
        "detalle": {
          "es": "incluye sistemas, pilotos, planes y capacidades",
          "en": "includes systems, pilots, plans and capabilities"
        }
      },
      {
        "label": {
          "es": "Instituciones con iniciativas documentadas",
          "en": "Institutions with documented initiatives"
        },
        "valor": "19",
        "detalle": {
          "es": "Poder Judicial, CCSS, Hacienda, MEP, MICITT, CENAT, UCR, INAMU, INS, ARESEP, INVU, INA, SBD, Municipalidad de Cartago, Municipalidad de La Unión, Ministerio de Salud, TEC, CGR y TSE",